{
    "$schema": "../../schemas/ai/ai-catalog.schema.json",
    "generated_by": "php tools/ai/generate-ai-catalog.php",
    "repository": {
        "name": "app-configs",
        "summary": "Opinionated development configuration plus a reusable cross-tool AI workflow kit.",
        "catalog_docs": [
            "docs/ai/catalog.md",
            "packages/ai-universal-rules/docs/BROWSE.md",
            "llms.txt"
        ]
    },
    "package": {
        "name": "ai-universal-rules",
        "version": "0.3.0",
        "description": "Portable AI workflow infrastructure for OpenCode and GitHub Copilot",
        "supported_tools": [
            "opencode",
            "github-copilot"
        ],
        "supported_surfaces": {
            "opencode": [
                "tui",
                "cli"
            ],
            "github-copilot": [
                "vscode",
                "cli",
                "github.com"
            ]
        },
        "generated_outputs": [
            "packages/ai-universal-rules/catalog.json",
            "packages/ai-universal-rules/docs/BROWSE.md",
            "docs/ai/catalog.md",
            "llms.txt"
        ]
    },
    "counts": {
        "package:core-template": 25,
        "package:foundation-doc": 6,
        "package:github-copilot-instruction-template": 22,
        "package:opencode-command-template": 5,
        "package:operations-doc": 6,
        "package:optional-template": 6,
        "package:package-capability": 43,
        "package:shared-template": 4,
        "package:workflow-doc": 6,
        "package:workflow-template": 34,
        "root:adapter-doc": 1,
        "root:adapter-hook": 2,
        "root:adapter-hook-script": 1,
        "root:adapter-policy": 1,
        "root:ai-script": 4,
        "root:capability": 17,
        "root:claude-agent": 12,
        "root:claude-command": 5,
        "root:claude-skill": 35,
        "root:cli": 1,
        "root:exporter": 2,
        "root:generator": 1,
        "root:github-copilot-agent": 11,
        "root:github-copilot-instruction": 22,
        "root:github-copilot-prompt": 34,
        "root:github-copilot-skill": 36,
        "root:opencode-agent": 13,
        "root:opencode-command": 36,
        "root:opencode-skill": 37,
        "root:php-reference": 3,
        "root:root-doc": 19,
        "root:schema": 1,
        "root:validator": 4,
        "root:verifier": 2
    },
    "resources": [
        {
            "scope": "package",
            "type": "core-template",
            "name": "<PROJECT_NAME> - Repository Instructions",
            "path": "packages/ai-universal-rules/templates/core/AGENTS.template.md",
            "runtime": "canonical",
            "description": "<!-- GENERATED \u2014 DO NOT EDIT: rendered by ai-kit installer from packages/ai-universal-rules/templates/core/AGENTS.template.md. Edit the template or .ai/project.yml, not this file. -->"
        },
        {
            "scope": "package",
            "type": "core-template",
            "name": "CLAUDE.md",
            "path": "packages/ai-universal-rules/templates/core/CLAUDE.template.md",
            "runtime": "canonical",
            "description": "<!-- GENERATED \u2014 DO NOT EDIT: rendered by ai-kit installer from packages/ai-universal-rules/templates/core/CLAUDE.template.md. Edit the template or .ai/project.yml, not this file. -->"
        },
        {
            "scope": "package",
            "type": "core-template",
            "name": "Post-Install Checklist",
            "path": "packages/ai-universal-rules/templates/core/POST-INSTALL.template.md",
            "runtime": "canonical",
            "description": "Your AI workflow kit was installed successfully. **Complete every item below before running write-capable AI agents.**"
        },
        {
            "scope": "package",
            "type": "core-template",
            "name": "Architect Agent",
            "path": "packages/ai-universal-rules/templates/core/agents/architect.md",
            "runtime": "canonical",
            "description": "Use when a change needs scoping, design, ownership decisions, contract boundaries, adapter strategy, or risk posture before implementation"
        },
        {
            "scope": "package",
            "type": "core-template",
            "name": "Bootstrapper Agent",
            "path": "packages/ai-universal-rules/templates/core/agents/bootstrapper.md",
            "runtime": "canonical",
            "description": "Use when installing, re-installing, or validating the AI kit from dry-run to backup to apply to full verification"
        },
        {
            "scope": "package",
            "type": "core-template",
            "name": "Configuration Maintainer Agent",
            "path": "packages/ai-universal-rules/templates/core/agents/configuration-maintainer.md",
            "runtime": "canonical",
            "description": "Use when changing editor, shell, runtime, or tool configuration while preserving current behavior"
        },
        {
            "scope": "package",
            "type": "core-template",
            "name": "Implementer Agent",
            "path": "packages/ai-universal-rules/templates/core/agents/implementer.md",
            "runtime": "canonical",
            "description": "Use when a bounded implementation slice is clear and focused verification should happen in this repository"
        },
        {
            "scope": "package",
            "type": "core-template",
            "name": "Orchestrator Agent",
            "path": "packages/ai-universal-rules/templates/core/agents/orchestrator.md",
            "runtime": "canonical",
            "description": "Use to coordinate a multi-step task by routing each stage to the right delivery agent (researcher, architect, plan-writer, implementer, configuration-maintainer, reviewer, release-auditor) through the shared handoff contract, owning loop and failure control. Does not edit, design, or review itself."
        },
        {
            "scope": "package",
            "type": "core-template",
            "name": "Plan Writer Agent",
            "path": "packages/ai-universal-rules/templates/core/agents/plan-writer.md",
            "runtime": "canonical",
            "description": "Use to persist a bounded architecture plan as a Todo markdown file under docs/tickets; architect hands off here to document the plan, steps, things-to-avoid, and acceptance criteria strictly scoped to the task or ticket"
        },
        {
            "scope": "package",
            "type": "core-template",
            "name": "Release Auditor Agent",
            "path": "packages/ai-universal-rules/templates/core/agents/release-auditor.md",
            "runtime": "canonical",
            "description": "Use when medium or high risk changes need rollout, rollback, migration, observability, preview, or install-safety review"
        },
        {
            "scope": "package",
            "type": "core-template",
            "name": "Researcher Agent",
            "path": "packages/ai-universal-rules/templates/core/agents/researcher.md",
            "runtime": "canonical",
            "description": "Use for read-only repository grounding when scope, ownership, usage, contracts, tests, adapter parity, generated artifacts, permissions, or current changes need investigation before planning, implementation, or review"
        },
        {
            "scope": "package",
            "type": "core-template",
            "name": "Reviewer Agent",
            "path": "packages/ai-universal-rules/templates/core/agents/reviewer.md",
            "runtime": "canonical",
            "description": "Use when reviewing a change set for correctness, regressions, policy fit, duplication, adapter drift, and missing verification"
        },
        {
            "scope": "package",
            "type": "core-template",
            "name": "<PROJECT_NAME> AI File Standards",
            "path": "packages/ai-universal-rules/templates/core/ai-file-standards.template.md",
            "runtime": "canonical",
            "description": "Use this file as the installed repository's canonical content and size contract for AI workflow files."
        },
        {
            "scope": "package",
            "type": "core-template",
            "name": "Repository Instructions For <PROJECT_NAME>",
            "path": "packages/ai-universal-rules/templates/core/copilot-instructions.template.md",
            "runtime": "canonical",
            "description": "Use these instructions as the repository-wide baseline for GitHub Copilot."
        },
        {
            "scope": "package",
            "type": "core-template",
            "name": "copilot-vscode-settings.template",
            "path": "packages/ai-universal-rules/templates/core/copilot-vscode-settings.template.json",
            "runtime": "canonical",
            "description": "{"
        },
        {
            "scope": "package",
            "type": "core-template",
            "name": "Execution Protocol",
            "path": "packages/ai-universal-rules/templates/core/execution-protocol.template.md",
            "runtime": "canonical",
            "description": "Use this as the canonical operating contract for non-trivial AI-assisted planning, editing, review, and verification."
        },
        {
            "scope": "package",
            "type": "core-template",
            "name": "Generated Artifacts Guide",
            "path": "packages/ai-universal-rules/templates/core/generated-artifacts.template.md",
            "runtime": "canonical",
            "description": "`docs/ai/generated/` holds machine-generated files produced by `php tools/ai/ai.php` subcommands."
        },
        {
            "scope": "package",
            "type": "core-template",
            "name": "opencode",
            "path": "packages/ai-universal-rules/templates/core/opencode.json",
            "runtime": "canonical",